rid,stable_id,joke,joke_cleaned,word_count,topic,topic_all_nouns,combo_key,combo_freq
726434,ffe3e5cb0ffb071a84e6dc722a45269171da7ad1,Candlemakers are so good at explaining things — They just make scents,candlemakers are so good at explaining things they just make scents,11,"scent, candlemaker","candlemaker, scent","candlemaker, scent",1
726597,fff20b0245089e2eeeb1ff3f9d98681079e4dc0d,"My favorite movie is..... Evolution, because we watch it everyday.","my favorite movie is ...  evolution , because we watch it everyday .",13,"movie, evolution","evolution, movie","evolution, movie",1
726748,ffffed57a9718663967e6ebe6b64c64a42bb4ff2,If someone does t want to eat a human... doesn't that make them a cantibal?,if someone does t want to eat a human ...  doesn't that make them a cantibal ?,17,"human, cantibal","cantibal, human","cantibal, human",1
726266,ffd451ce117382f786ebbafe558e1e7716c722dd,I'm at my most nurturing when I'm plotting a way to drop my 12 yr old at school 3 days early.,i'm at my most nurturing when i'm plotting a way to drop my 12 yr old at school 3 days early .,22,"school, nurturing","nurturing, school","nurturing, school",1
726311,ffd834f991994508046362669bb5690d075a6fae,If Hitler had a long commute he would be an anti-semi,if hitler had a long commute he would be an anti-semi,11,"hitler, commute","commute, hitler","commute, hitler",1
